{
  "hostname": "spark-3542",
  "boot_id": "c6afa783-c241-45d1-b322-e8154b20188c",
  "os": {
    "PRETTY_NAME": "Ubuntu 24.04.4 LTS",
    "NAME": "Ubuntu",
    "VERSION_ID": "24.04",
    "VERSION": "24.04.4 LTS (Noble Numbat)",
    "VERSION_CODENAME": "noble",
    "ID": "ubuntu",
    "ID_LIKE": "debian",
    "HOME_URL": "https://www.ubuntu.com/",
    "SUPPORT_URL": "https://help.ubuntu.com/",
    "BUG_REPORT_URL": "https://bugs.launchpad.net/ubuntu/",
    "PRIVACY_POLICY_URL": "https://www.ubuntu.com/legal/terms-and-policies/privacy-policy",
    "UBUNTU_CODENAME": "noble",
    "LOGO": "ubuntu-logo"
  },
  "kernel": {
    "uname": "Linux 6.17.0-1029-nvidia aarch64 GNU/Linux"
  },
  "memory": {
    "total_bytes": 130663231488,
    "available_bytes": 126990147584
  },
  "swap": {
    "total_bytes": 17179865088,
    "free_bytes": 17179865088
  },
  "disks": [
    {
      "name": "loop0",
      "maj:min": "7:0",
      "rm": false,
      "size": 4096,
      "ro": true,
      "type": "loop",
      "mountpoints": [
        "/snap/bare/5"
      ]
    },
    {
      "name": "loop1",
      "maj:min": "7:1",
      "rm": false,
      "size": 72310784,
      "ro": true,
      "type": "loop",
      "mountpoints": [
        "/snap/core22/2412"
      ]
    },
    {
      "name": "loop2",
      "maj:min": "7:2",
      "rm": false,
      "size": 257073152,
      "ro": true,
      "type": "loop",
      "mountpoints": [
        "/snap/firefox/8661"
      ]
    },
    {
      "name": "loop3",
      "maj:min": "7:3",
      "rm": false,
      "size": 64864256,
      "ro": true,
      "type": "loop",
      "mountpoints": [
        "/snap/core24/1644"
      ]
    },
    {
      "name": "loop4",
      "maj:min": "7:4",
      "rm": false,
      "size": 527577088,
      "ro": true,
      "type": "loop",
      "mountpoints": [
        "/snap/gnome-42-2204/264"
      ]
    },
    {
      "name": "loop5",
      "maj:min": "7:5",
      "rm": false,
      "size": 10719232,
      "ro": true,
      "type": "loop",
      "mountpoints": [
        "/snap/firmware-updater/168"
      ]
    },
    {
      "name": "loop6",
      "maj:min": "7:6",
      "rm": false,
      "size": 197390336,
      "ro": true,
      "type": "loop",
      "mountpoints": [
        "/snap/mesa-2404/1836"
      ]
    },
    {
      "name": "loop7",
      "maj:min": "7:7",
      "rm": false,
      "size": 10530816,
      "ro": true,
      "type": "loop",
      "mountpoints": [
        "/snap/snap-store/1271"
      ]
    },
    {
      "name": "loop8",
      "maj:min": "7:8",
      "rm": false,
      "size": 96141312,
      "ro": true,
      "type": "loop",
      "mountpoints": [
        "/snap/gtk-common-themes/1535"
      ]
    },
    {
      "name": "loop9",
      "maj:min": "7:9",
      "rm": false,
      "size": 579809280,
      "ro": true,
      "type": "loop",
      "mountpoints": [
        "/snap/gnome-46-2404/154"
      ]
    },
    {
      "name": "loop10",
      "maj:min": "7:10",
      "rm": false,
      "size": 565248,
      "ro": true,
      "type": "loop",
      "mountpoints": [
        "/snap/snapd-desktop-integration/316"
      ]
    },
    {
      "name": "loop11",
      "maj:min": "7:11",
      "rm": false,
      "size": 45477888,
      "ro": true,
      "type": "loop",
      "mountpoints": [
        "/snap/snapd/27595"
      ]
    },
    {
      "name": "loop12",
      "maj:min": "7:12",
      "rm": false,
      "size": 223092736,
      "ro": true,
      "type": "loop",
      "mountpoints": [
        "/snap/thunderbird/1200"
      ]
    },
    {
      "name": "nvme0n1",
      "maj:min": "259:0",
      "rm": false,
      "size": 4096805658624,
      "ro": false,
      "type": "disk",
      "mountpoints": [
        null
      ],
      "children": [
        {
          "name": "nvme0n1p1",
          "maj:min": "259:1",
          "rm": false,
          "size": 312475648,
          "ro": false,
          "type": "part",
          "mountpoints": [
            "/boot/efi"
          ]
        },
        {
          "name": "nvme0n1p2",
          "maj:min": "259:2",
          "rm": false,
          "size": 4096492117504,
          "ro": false,
          "type": "part",
          "mountpoints": [
            "/"
          ]
        }
      ]
    }
  ],
  "filesystems": [
    {
      "filesystem": "tmpfs",
      "size_bytes": 13066326016,
      "used_bytes": 2383872,
      "available_bytes": 13063942144,
      "use_percent": "1%",
      "mountpoint": "/run"
    },
    {
      "filesystem": "efivarfs",
      "size_bytes": 262144,
      "used_bytes": 19619,
      "available_bytes": 242525,
      "use_percent": "8%",
      "mountpoint": "/sys/firmware/efi/efivars"
    },
    {
      "filesystem": "/dev/nvme0n1p2",
      "size_bytes": 4031871553536,
      "used_bytes": 40020983808,
      "available_bytes": 3787009835008,
      "use_percent": "2%",
      "mountpoint": "/"
    },
    {
      "filesystem": "tmpfs",
      "size_bytes": 65331613696,
      "used_bytes": 0,
      "available_bytes": 65331613696,
      "use_percent": "0%",
      "mountpoint": "/dev/shm"
    },
    {
      "filesystem": "tmpfs",
      "size_bytes": 5242880,
      "used_bytes": 8192,
      "available_bytes": 5234688,
      "use_percent": "1%",
      "mountpoint": "/run/lock"
    },
    {
      "filesystem": "/dev/nvme0n1p1",
      "size_bytes": 311844864,
      "used_bytes": 6676480,
      "available_bytes": 305168384,
      "use_percent": "3%",
      "mountpoint": "/boot/efi"
    },
    {
      "filesystem": "tmpfs",
      "size_bytes": 13066321920,
      "used_bytes": 106496,
      "available_bytes": 13066215424,
      "use_percent": "1%",
      "mountpoint": "/run/user/126"
    },
    {
      "filesystem": "tmpfs",
      "size_bytes": 13066321920,
      "used_bytes": 102400,
      "available_bytes": 13066219520,
      "use_percent": "1%",
      "mountpoint": "/run/user/1000"
    }
  ],
  "earlyoom": {
    "enabled": "not-found",
    "active": "inactive"
  },
  "nvidia": null,
  "docker": {
    "engine": null,
    "compose": {
      "version": "v5.0.2"
    }
  },
  "interfaces": [
    {
      "ifindex": 1,
      "ifname": "lo",
      "flags": [
        "LOOPBACK",
        "UP",
        "LOWER_UP"
      ],
      "mtu": 65536,
      "qdisc": "noqueue",
      "operstate": "UNKNOWN",
      "group": "default",
      "txqlen": 1000,
      "link_type": "loopback",
      "address": "00:00:00:00:00:00",
      "broadcast": "00:00:00:00:00:00",
      "addr_info": [
        {
          "family": "inet",
          "local": "127.0.0.1",
          "prefixlen": 8,
          "scope": "host",
          "label": "lo",
          "valid_life_time": 4294967295,
          "preferred_life_time": 4294967295
        },
        {
          "family": "inet6",
          "local": "::1",
          "prefixlen": 128,
          "scope": "host",
          "noprefixroute": true,
          "valid_life_time": 4294967295,
          "preferred_life_time": 4294967295
        }
      ]
    },
    {
      "ifindex": 2,
      "ifname": "enP7s7",
      "flags": [
        "NO-CARRIER",
        "BROADCAST",
        "MULTICAST",
        "UP"
      ],
      "mtu": 1500,
      "qdisc": "mq",
      "operstate": "DOWN",
      "group": "default",
      "txqlen": 1000,
      "link_type": "ether",
      "address": "4c:bb:47:e8:35:42",
      "broadcast": "ff:ff:ff:ff:ff:ff",
      "altnames": [
        "enP7p1s0"
      ],
      "addr_info": []
    },
    {
      "ifindex": 3,
      "ifname": "enp1s0f0np0",
      "flags": [
        "NO-CARRIER",
        "BROADCAST",
        "MULTICAST",
        "UP"
      ],
      "mtu": 1500,
      "qdisc": "mq",
      "operstate": "DOWN",
      "group": "default",
      "txqlen": 1000,
      "link_type": "ether",
      "address": "4c:bb:47:e8:35:43",
      "broadcast": "ff:ff:ff:ff:ff:ff",
      "addr_info": []
    },
    {
      "ifindex": 4,
      "ifname": "enp1s0f1np1",
      "flags": [
        "BROADCAST",
        "MULTICAST",
        "UP",
        "LOWER_UP"
      ],
      "mtu": 1500,
      "qdisc": "mq",
      "operstate": "UP",
      "group": "default",
      "txqlen": 1000,
      "link_type": "ether",
      "address": "4c:bb:47:e8:35:44",
      "broadcast": "ff:ff:ff:ff:ff:ff",
      "addr_info": []
    },
    {
      "ifindex": 5,
      "ifname": "enP2p1s0f0np0",
      "flags": [
        "NO-CARRIER",
        "BROADCAST",
        "MULTICAST",
        "UP"
      ],
      "mtu": 1500,
      "qdisc": "mq",
      "operstate": "DOWN",
      "group": "default",
      "txqlen": 1000,
      "link_type": "ether",
      "address": "4c:bb:47:e8:35:47",
      "broadcast": "ff:ff:ff:ff:ff:ff",
      "addr_info": []
    },
    {
      "ifindex": 6,
      "ifname": "enP2p1s0f1np1",
      "flags": [
        "BROADCAST",
        "MULTICAST",
        "UP",
        "LOWER_UP"
      ],
      "mtu": 1500,
      "qdisc": "mq",
      "operstate": "UP",
      "group": "default",
      "txqlen": 1000,
      "link_type": "ether",
      "address": "4c:bb:47:e8:35:48",
      "broadcast": "ff:ff:ff:ff:ff:ff",
      "addr_info": []
    },
    {
      "ifindex": 7,
      "ifname": "wlP9s9",
      "flags": [
        "BROADCAST",
        "MULTICAST",
        "UP",
        "LOWER_UP"
      ],
      "mtu": 1500,
      "qdisc": "noqueue",
      "operstate": "UP",
      "group": "default",
      "txqlen": 1000,
      "link_type": "ether",
      "address": "f0:68:e3:b3:4c:84",
      "broadcast": "ff:ff:ff:ff:ff:ff",
      "altnames": [
        "wlP9p1s0"
      ],
      "addr_info": [
        {
          "family": "inet",
          "local": "192.168.1.211",
          "prefixlen": 24,
          "broadcast": "192.168.1.255",
          "scope": "global",
          "dynamic": true,
          "noprefixroute": true,
          "label": "wlP9s9",
          "valid_life_time": 74963,
          "preferred_life_time": 74963
        },
        {
          "family": "inet6",
          "local": "fdf1:bc43:d25d:434d:d29d:6964:f7:7ecd",